{
  "artifacts": [
    {
      "bytes": 106637,
      "kind": "results",
      "path": "../results.json",
      "sha256": "bfb85fed9ef15fd534ab4db6530ac539ad92999c6908f37cb68d5ac8275eb939"
    },
    {
      "bytes": 178577,
      "kind": "raw_measurements",
      "path": "../duffing_nonlinearity_raw.npz",
      "sha256": "db96e6ac50363bdcb6b05ee217f6181b89d85b96b3493bbe6dd77a58ad229a41"
    },
    {
      "bytes": 52569,
      "kind": "benchmark_sensitivity",
      "path": "../benchmark/metrics.json",
      "sha256": "fb5d9f0ba578bee0a55181481e91da3db2d03bdb164a69d97c26c9e9bd9baf9c"
    },
    {
      "bytes": 122172,
      "kind": "figure",
      "path": "../duffing_counterexample.png",
      "sha256": "f72d6487393beb733b8278feeffd5180d4d7921b157dbcee3b375ef746a5a289"
    }
  ],
  "candidate": {
    "coefficients": {
      "quadratic": 4.031008449037536,
      "quartic": 0.0
    },
    "expression": "Q = v^2 + 4.031008 x^2",
    "variable_units": {
      "Q": "m^2/s^2",
      "quadratic_coefficient": "s^-2",
      "quartic_coefficient": "m^-2 s^-2",
      "time": "s",
      "v": "m/s",
      "x": "m"
    }
  },
  "counterexamples": [
    {
      "amplitude": 0.5,
      "horizon": 2.0,
      "relative_drift": 0.02345700894698942,
      "status": "REFUTED",
      "threshold": 0.02,
      "threshold_kind": "DEMONSTRATION_THRESHOLD",
      "uncertainty_allowance": 0.0,
      "uncertainty_kind": "uncalibrated conservative instrument-noise heuristic"
    },
    {
      "amplitude": 0.5,
      "horizon": 6.0,
      "relative_drift": 0.023422344308321803,
      "status": "REFUTED",
      "threshold": 0.02,
      "threshold_kind": "DEMONSTRATION_THRESHOLD",
      "uncertainty_allowance": 0.0,
      "uncertainty_kind": "uncalibrated conservative instrument-noise heuristic"
    },
    {
      "amplitude": 0.5,
      "horizon": 12.0,
      "relative_drift": 0.023424043788525077,
      "status": "REFUTED",
      "threshold": 0.02,
      "threshold_kind": "DEMONSTRATION_THRESHOLD",
      "uncertainty_allowance": 0.0,
      "uncertainty_kind": "uncalibrated conservative instrument-noise heuristic"
    },
    {
      "amplitude": 0.9,
      "horizon": 2.0,
      "relative_drift": 0.08798358618200497,
      "status": "REFUTED",
      "threshold": 0.02,
      "threshold_kind": "DEMONSTRATION_THRESHOLD",
      "uncertainty_allowance": 0.0,
      "uncertainty_kind": "uncalibrated conservative instrument-noise heuristic"
    },
    {
      "amplitude": 0.9,
      "horizon": 6.0,
      "relative_drift": 0.08782697176294098,
      "status": "REFUTED",
      "threshold": 0.02,
      "threshold_kind": "DEMONSTRATION_THRESHOLD",
      "uncertainty_allowance": 0.0,
      "uncertainty_kind": "uncalibrated conservative instrument-noise heuristic"
    },
    {
      "amplitude": 0.9,
      "horizon": 12.0,
      "relative_drift": 0.08779356644569196,
      "status": "REFUTED",
      "threshold": 0.02,
      "threshold_kind": "DEMONSTRATION_THRESHOLD",
      "uncertainty_allowance": 0.0,
      "uncertainty_kind": "uncalibrated conservative instrument-noise heuristic"
    },
    {
      "amplitude": 1.3,
      "horizon": 2.0,
      "relative_drift": 0.17922543224178128,
      "status": "REFUTED",
      "threshold": 0.02,
      "threshold_kind": "DEMONSTRATION_THRESHOLD",
      "uncertainty_allowance": 0.0,
      "uncertainty_kind": "uncalibrated conservative instrument-noise heuristic"
    },
    {
      "amplitude": 1.3,
      "horizon": 6.0,
      "relative_drift": 0.17922407176645136,
      "status": "REFUTED",
      "threshold": 0.02,
      "threshold_kind": "DEMONSTRATION_THRESHOLD",
      "uncertainty_allowance": 0.0,
      "uncertainty_kind": "uncalibrated conservative instrument-noise heuristic"
    },
    {
      "amplitude": 1.3,
      "horizon": 12.0,
      "relative_drift": 0.1786261043116325,
      "status": "REFUTED",
      "threshold": 0.02,
      "threshold_kind": "DEMONSTRATION_THRESHOLD",
      "uncertainty_allowance": 0.0,
      "uncertainty_kind": "uncalibrated conservative instrument-noise heuristic"
    },
    {
      "amplitude": 1.7,
      "horizon": 2.0,
      "relative_drift": 0.2849241973315559,
      "status": "REFUTED",
      "threshold": 0.02,
      "threshold_kind": "DEMONSTRATION_THRESHOLD",
      "uncertainty_allowance": 0.0,
      "uncertainty_kind": "uncalibrated conservative instrument-noise heuristic"
    },
    {
      "amplitude": 1.7,
      "horizon": 6.0,
      "relative_drift": 0.28507534471898666,
      "status": "REFUTED",
      "threshold": 0.02,
      "threshold_kind": "DEMONSTRATION_THRESHOLD",
      "uncertainty_allowance": 0.0,
      "uncertainty_kind": "uncalibrated conservative instrument-noise heuristic"
    },
    {
      "amplitude": 1.7,
      "horizon": 12.0,
      "relative_drift": 0.28646232549247586,
      "status": "REFUTED",
      "threshold": 0.02,
      "threshold_kind": "DEMONSTRATION_THRESHOLD",
      "uncertainty_allowance": 0.0,
      "uncertainty_kind": "uncalibrated conservative instrument-noise heuristic"
    }
  ],
  "created_at_utc": "2026-10-21T18:24:02.709447+00:00",
  "experiment_queue": [
    {
      "id": "e0000",
      "kind": "oscillator",
      "knobs": {
        "amplitude": 0.12,
        "atol": 1e-13,
        "horizon": 0.8,
        "initial_velocity": 0.0,
        "noise_sd_v_m_s": 0.0,
        "noise_sd_x_m": 0.0,
        "rtol": 2e-11,
        "steps": 121
      },
      "measurements": 242,
      "observation_points": 121,
      "partition": "discovery",
      "raw_keys": [
        "e0000_time",
        "e0000_x",
        "e0000_v"
      ],
      "rhs_evaluations": 122,
      "simulated_duration_s": 0.8,
      "simulator_calls": 1,
      "status": "COMPLETED"
    },
    {
      "id": "e0001",
      "kind": "oscillator",
      "knobs": {
        "amplitude": 0.2,
        "atol": 1e-13,
        "horizon": 0.8,
        "initial_velocity": 0.06,
        "noise_sd_v_m_s": 0.0,
        "noise_sd_x_m": 0.0,
        "rtol": 2e-11,
        "steps": 121
      },
      "measurements": 242,
      "observation_points": 121,
      "partition": "discovery",
      "raw_keys": [
        "e0001_time",
        "e0001_x",
        "e0001_v"
      ],
      "rhs_evaluations": 122,
      "simulated_duration_s": 0.8,
      "simulator_calls": 1,
      "status": "COMPLETED"
    },
    {
      "id": "e0002",
      "kind": "oscillator",
      "knobs": {
        "amplitude": 0.27,
        "atol": 1e-13,
        "horizon": 0.8,
        "initial_velocity": -0.04,
        "noise_sd_v_m_s": 0.0,
        "noise_sd_x_m": 0.0,
        "rtol": 2e-11,
        "steps": 121
      },
      "measurements": 242,
      "observation_points": 121,
      "partition": "discovery",
      "raw_keys": [
        "e0002_time",
        "e0002_x",
        "e0002_v"
      ],
      "rhs_evaluations": 122,
      "simulated_duration_s": 0.8,
      "simulator_calls": 1,
      "status": "COMPLETED"
    },
    {
      "id": "e0003",
      "kind": "oscillator",
      "knobs": {
        "amplitude": 0.2,
        "atol": 1e-13,
        "horizon": 2.0,
        "initial_velocity": 0.0,
        "noise_sd_v_m_s": 0.0,
        "noise_sd_x_m": 0.0,
        "rtol": 2e-11,
        "steps": 401
      },
      "measurements": 802,
      "observation_points": 401,
      "partition": "probe",
      "raw_keys": [
        "e0003_time",
        "e0003_x",
        "e0003_v"
      ],
      "rhs_evaluations": 257,
      "simulated_duration_s": 2.0,
      "simulator_calls": 1,
      "status": "COMPLETED"
    },
    {
      "id": "e0004",
      "kind": "oscillator",
      "knobs": {
        "amplitude": 0.2,
        "atol": 1e-13,
        "horizon": 6.0,
        "initial_velocity": 0.0,
        "noise_sd_v_m_s": 0.0,
        "noise_sd_x_m": 0.0,
        "rtol": 2e-11,
        "steps": 401
      },
      "measurements": 802,
      "observation_points": 401,
      "partition": "probe",
      "raw_keys": [
        "e0004_time",
        "e0004_x",
        "e0004_v"
      ],
      "rhs_evaluations": 722,
      "simulated_duration_s": 6.0,
      "simulator_calls": 1,
      "status": "COMPLETED"
    },
    {
      "id": "e0005",
      "kind": "oscillator",
      "knobs": {
        "amplitude": 0.2,
        "atol": 1e-13,
        "horizon": 12.0,
        "initial_velocity": 0.0,
        "noise_sd_v_m_s": 0.0,
        "noise_sd_x_m": 0.0,
        "rtol": 2e-11,
        "steps": 401
      },
      "measurements": 802,
      "observation_points": 401,
      "partition": "probe",
      "raw_keys": [
        "e0005_time",
        "e0005_x",
        "e0005_v"
      ],
      "rhs_evaluations": 1412,
      "simulated_duration_s": 12.0,
      "simulator_calls": 1,
      "status": "COMPLETED"
    },
    {
      "id": "e0006",
      "kind": "oscillator",
      "knobs": {
        "amplitude": 0.5,
        "atol": 1e-13,
        "horizon": 2.0,
        "initial_velocity": 0.0,
        "noise_sd_v_m_s": 0.0,
        "noise_sd_x_m": 0.0,
        "rtol": 2e-11,
        "steps": 401
      },
      "measurements": 802,
      "observation_points": 401,
      "partition": "probe",
      "raw_keys": [
        "e0006_time",
        "e0006_x",
        "e0006_v"
      ],
      "rhs_evaluations": 341,
      "simulated_duration_s": 2.0,
      "simulator_calls": 1,
      "status": "COMPLETED"
    },
    {
      "id": "e0007",
      "kind": "oscillator",
      "knobs": {
        "amplitude": 0.5,
        "atol": 1e-13,
        "horizon": 6.0,
        "initial_velocity": 0.0,
        "noise_sd_v_m_s": 0.0,
        "noise_sd_x_m": 0.0,
        "rtol": 2e-11,
        "steps": 401
      },
      "measurements": 802,
      "observation_points": 401,
      "partition": "probe",
      "raw_keys": [
        "e0007_time",
        "e0007_x",
        "e0007_v"
      ],
      "rhs_evaluations": 974,
      "simulated_duration_s": 6.0,
      "simulator_calls": 1,
      "status": "COMPLETED"
    },
    {
      "id": "e0008",
      "kind": "oscillator",
      "knobs": {